{
  "id": "base:aldermere_reckoning",
  "type": "board_game",
  "name": "loc:board_game.aldermere_reckoning",
  "designer": "Verdance Reyes",
  "player_count": [
    3,
    5
  ],
  "play_minutes": [
    38,
    115
  ],
  "weight": 2.2,
  "teach_minutes": 10,
  "retail_price": 44.5,
  "library_eligible": true,
  "shelf_footprint": [
    1,
    1
  ],
  "components": [
    {
      "part": "wooden cube",
      "count": 40,
      "loss_weight": 0.9
    },
    {
      "part": "player board",
      "count": 24,
      "loss_weight": 0.1
    },
    {
      "part": "linen bag",
      "count": 4,
      "loss_weight": 0.4
    },
    {
      "part": "meeple",
      "count": 24,
      "loss_weight": 0.7
    }
  ],
  "tags": [
    "midweight",
    "teaching_friendly"
  ]
}
