{
  "id": "base:longshore_union",
  "type": "board_game",
  "name": "loc:board_game.longshore_union",
  "designer": "Emberdown Reyes",
  "player_count": [
    2,
    3
  ],
  "play_minutes": [
    66,
    93
  ],
  "weight": 2.4,
  "teach_minutes": 16,
  "retail_price": 34.29,
  "library_eligible": true,
  "shelf_footprint": [
    1,
    1
  ],
  "components": [
    {
      "part": "wooden cube",
      "count": 12,
      "loss_weight": 0.9
    },
    {
      "part": "meeple",
      "count": 12,
      "loss_weight": 0.7
    },
    {
      "part": "scoring marker",
      "count": 40,
      "loss_weight": 0.75
    }
  ],
  "tags": [
    "midweight",
    "teaching_friendly"
  ]
}
