{
  "id": "base:aldermere_network",
  "type": "board_game",
  "name": "loc:board_game.aldermere_network",
  "designer": "Fenwick Baptiste",
  "player_count": [
    2,
    4
  ],
  "play_minutes": [
    58,
    113
  ],
  "weight": 2.8,
  "teach_minutes": 11,
  "retail_price": 54.88,
  "library_eligible": true,
  "shelf_footprint": [
    1,
    1
  ],
  "components": [
    {
      "part": "card",
      "count": 24,
      "loss_weight": 0.3
    },
    {
      "part": "scoring marker",
      "count": 104,
      "loss_weight": 0.75
    },
    {
      "part": "plastic stand",
      "count": 104,
      "loss_weight": 0.65
    }
  ],
  "tags": [
    "component_dense",
    "midweight"
  ]
}
