{
  "id": "base:oxbow_tramway",
  "type": "board_game",
  "name": "loc:board_game.oxbow_tramway",
  "designer": "Harbourline Reyes",
  "player_count": [
    1,
    3
  ],
  "play_minutes": [
    75,
    111
  ],
  "weight": 3.7,
  "teach_minutes": 22,
  "retail_price": 62.34,
  "library_eligible": true,
  "shelf_footprint": [
    2,
    1
  ],
  "components": [
    {
      "part": "die",
      "count": 104,
      "loss_weight": 0.85
    },
    {
      "part": "card",
      "count": 40,
      "loss_weight": 0.3
    },
    {
      "part": "plastic stand",
      "count": 8,
      "loss_weight": 0.65
    },
    {
      "part": "scoring marker",
      "count": 12,
      "loss_weight": 0.75
    },
    {
      "part": "resource tile",
      "count": 104,
      "loss_weight": 0.5
    },
    {
      "part": "linen bag",
      "count": 8,
      "loss_weight": 0.4
    }
  ],
  "tags": [
    "component_dense",
    "heavy"
  ]
}
