{
  "id": "base:oxbow_dispatch",
  "type": "board_game",
  "name": "loc:board_game.oxbow_dispatch",
  "designer": "Stillwater Lindqvist",
  "player_count": [
    2,
    3
  ],
  "play_minutes": [
    51,
    89
  ],
  "weight": 1.7,
  "teach_minutes": 8,
  "retail_price": 31.06,
  "library_eligible": true,
  "shelf_footprint": [
    1,
    1
  ],
  "components": [
    {
      "part": "resource tile",
      "count": 8,
      "loss_weight": 0.5
    },
    {
      "part": "wooden cube",
      "count": 40,
      "loss_weight": 0.9
    },
    {
      "part": "first-player marker",
      "count": 60,
      "loss_weight": 0.8
    },
    {
      "part": "player board",
      "count": 8,
      "loss_weight": 0.1
    },
    {
      "part": "rulebook",
      "count": 60,
      "loss_weight": 0.15
    }
  ],
  "tags": [
    "filler",
    "teaching_friendly"
  ]
}
