{
  "id": "base:kestrel_registry",
  "type": "board_game",
  "name": "loc:board_game.kestrel_registry",
  "designer": "Vesper Okoro",
  "player_count": [
    2,
    4
  ],
  "play_minutes": [
    83,
    144
  ],
  "weight": 3.9,
  "teach_minutes": 29,
  "retail_price": 72.34,
  "library_eligible": true,
  "shelf_footprint": [
    2,
    1
  ],
  "components": [
    {
      "part": "wooden cube",
      "count": 4,
      "loss_weight": 0.9
    },
    {
      "part": "meeple",
      "count": 104,
      "loss_weight": 0.7
    },
    {
      "part": "die",
      "count": 8,
      "loss_weight": 0.85
    },
    {
      "part": "rulebook",
      "count": 8,
      "loss_weight": 0.15
    },
    {
      "part": "player board",
      "count": 24,
      "loss_weight": 0.1
    },
    {
      "part": "card",
      "count": 24,
      "loss_weight": 0.3
    }
  ],
  "tags": [
    "heavy"
  ]
}
