{
  "id": "base:coalfall_interchange",
  "type": "board_game",
  "name": "loc:board_game.coalfall_interchange",
  "designer": "Saltmarsh Okoro",
  "player_count": [
    2,
    5
  ],
  "play_minutes": [
    33,
    83
  ],
  "weight": 1.9,
  "teach_minutes": 13,
  "retail_price": 39.41,
  "library_eligible": true,
  "shelf_footprint": [
    1,
    1
  ],
  "components": [
    {
      "part": "card",
      "count": 24,
      "loss_weight": 0.3
    },
    {
      "part": "scoring marker",
      "count": 104,
      "loss_weight": 0.75
    },
    {
      "part": "die",
      "count": 40,
      "loss_weight": 0.85
    },
    {
      "part": "plastic stand",
      "count": 120,
      "loss_weight": 0.65
    }
  ],
  "tags": [
    "component_dense",
    "filler",
    "teaching_friendly"
  ]
}
