{
  "id": "base:lanternwick_consortium",
  "type": "board_game",
  "name": "loc:board_game.lanternwick_consortium",
  "designer": "Umberfield Vance",
  "player_count": [
    3,
    5
  ],
  "play_minutes": [
    92,
    153
  ],
  "weight": 3.9,
  "teach_minutes": 13,
  "retail_price": 59.44,
  "library_eligible": true,
  "shelf_footprint": [
    2,
    1
  ],
  "components": [
    {
      "part": "plastic stand",
      "count": 40,
      "loss_weight": 0.65
    },
    {
      "part": "card",
      "count": 8,
      "loss_weight": 0.3
    },
    {
      "part": "wooden cube",
      "count": 24,
      "loss_weight": 0.9
    },
    {
      "part": "first-player marker",
      "count": 60,
      "loss_weight": 0.8
    },
    {
      "part": "player board",
      "count": 12,
      "loss_weight": 0.1
    },
    {
      "part": "rulebook",
      "count": 12,
      "loss_weight": 0.15
    }
  ],
  "tags": [
    "heavy"
  ]
}
