{
  "id": "base:verdance_ferry",
  "type": "board_game",
  "name": "loc:board_game.verdance_ferry",
  "designer": "Coalfall Okoro",
  "player_count": [
    3,
    5
  ],
  "play_minutes": [
    60,
    87
  ],
  "weight": 2.2,
  "teach_minutes": 14,
  "retail_price": 31.83,
  "library_eligible": true,
  "shelf_footprint": [
    1,
    1
  ],
  "components": [
    {
      "part": "wooden cube",
      "count": 12,
      "loss_weight": 0.9
    },
    {
      "part": "meeple",
      "count": 104,
      "loss_weight": 0.7
    },
    {
      "part": "scoring marker",
      "count": 12,
      "loss_weight": 0.75
    }
  ],
  "tags": [
    "midweight",
    "teaching_friendly"
  ]
}
