{
  "id": "base:quarrystone_interchange",
  "type": "board_game",
  "name": "loc:board_game.quarrystone_interchange",
  "designer": "Elmgate Baptiste",
  "player_count": [
    2,
    3
  ],
  "play_minutes": [
    32,
    77
  ],
  "weight": 2.0,
  "teach_minutes": 7,
  "retail_price": 41.35,
  "library_eligible": true,
  "shelf_footprint": [
    1,
    1
  ],
  "components": [
    {
      "part": "cardboard token",
      "count": 104,
      "loss_weight": 0.6
    },
    {
      "part": "first-player marker",
      "count": 104,
      "loss_weight": 0.8
    },
    {
      "part": "meeple",
      "count": 104,
      "loss_weight": 0.7
    },
    {
      "part": "plastic stand",
      "count": 40,
      "loss_weight": 0.65
    },
    {
      "part": "scoring marker",
      "count": 24,
      "loss_weight": 0.75
    },
    {
      "part": "card",
      "count": 24,
      "loss_weight": 0.3
    }
  ],
  "tags": [
    "component_dense",
    "midweight",
    "teaching_friendly"
  ]
}
