{
  "id": "base:northreach_registry",
  "type": "board_game",
  "name": "loc:board_game.northreach_registry",
  "designer": "Aldermere Vance",
  "player_count": [
    2,
    5
  ],
  "play_minutes": [
    33,
    105
  ],
  "weight": 1.9,
  "teach_minutes": 12,
  "retail_price": 43.21,
  "library_eligible": true,
  "shelf_footprint": [
    1,
    1
  ],
  "components": [
    {
      "part": "meeple",
      "count": 40,
      "loss_weight": 0.7
    },
    {
      "part": "first-player marker",
      "count": 24,
      "loss_weight": 0.8
    },
    {
      "part": "wooden cube",
      "count": 104,
      "loss_weight": 0.9
    },
    {
      "part": "player board",
      "count": 4,
      "loss_weight": 0.1
    },
    {
      "part": "die",
      "count": 60,
      "loss_weight": 0.85
    }
  ],
  "tags": [
    "component_dense",
    "filler",
    "teaching_friendly"
  ]
}
