{
  "id": "base:foxglove_orchard",
  "type": "board_game",
  "name": "loc:board_game.foxglove_orchard",
  "designer": "Mossgard Okoro",
  "player_count": [
    2,
    4
  ],
  "play_minutes": [
    81,
    119
  ],
  "weight": 3.6,
  "teach_minutes": 27,
  "retail_price": 46.45,
  "library_eligible": true,
  "shelf_footprint": [
    2,
    1
  ],
  "components": [
    {
      "part": "linen bag",
      "count": 120,
      "loss_weight": 0.4
    },
    {
      "part": "plastic stand",
      "count": 120,
      "loss_weight": 0.65
    },
    {
      "part": "resource tile",
      "count": 60,
      "loss_weight": 0.5
    },
    {
      "part": "card",
      "count": 12,
      "loss_weight": 0.3
    },
    {
      "part": "meeple",
      "count": 4,
      "loss_weight": 0.7
    },
    {
      "part": "player board",
      "count": 60,
      "loss_weight": 0.1
    },
    {
      "part": "rulebook",
      "count": 4,
      "loss_weight": 0.15
    }
  ],
  "tags": [
    "component_dense",
    "heavy"
  ]
}
