{
  "id": "base:kestrel_gazette",
  "type": "board_game",
  "name": "loc:board_game.kestrel_gazette",
  "designer": "Pinehaven Vance",
  "player_count": [
    2,
    3
  ],
  "play_minutes": [
    29,
    113
  ],
  "weight": 1.5,
  "teach_minutes": 11,
  "retail_price": 32.33,
  "library_eligible": true,
  "shelf_footprint": [
    1,
    1
  ],
  "components": [
    {
      "part": "cardboard token",
      "count": 8,
      "loss_weight": 0.6
    },
    {
      "part": "resource tile",
      "count": 40,
      "loss_weight": 0.5
    },
    {
      "part": "meeple",
      "count": 8,
      "loss_weight": 0.7
    }
  ],
  "tags": [
    "filler",
    "teaching_friendly"
  ]
}
