{
  "id": "base:drakemoor_junction",
  "type": "board_game",
  "name": "loc:board_game.drakemoor_junction",
  "designer": "Harbourline Reyes",
  "player_count": [
    2,
    5
  ],
  "play_minutes": [
    54,
    87
  ],
  "weight": 3.6,
  "teach_minutes": 18,
  "retail_price": 46.23,
  "library_eligible": false,
  "shelf_footprint": [
    2,
    1
  ],
  "components": [
    {
      "part": "cardboard token",
      "count": 60,
      "loss_weight": 0.6
    },
    {
      "part": "meeple",
      "count": 24,
      "loss_weight": 0.7
    },
    {
      "part": "resource tile",
      "count": 60,
      "loss_weight": 0.5
    },
    {
      "part": "plastic stand",
      "count": 120,
      "loss_weight": 0.65
    }
  ],
  "tags": [
    "component_dense",
    "heavy"
  ]
}
